{
  "schema_version": "1.0.0",
  "payload_type": "artifact_links",
  "vertical": "fintech",
  "artifacts": [
    {
      "artifact_id": "fintech_3_dashboard_001",
      "vertical": "fintech",
      "month": 3,
      "type": "dashboard",
      "url": "https://bayesiq-dashboard-golden-flows-fintech.streamlit.app",
      "title": "Fintech Data Quality Dashboard — Month 3"
    },
    {
      "artifact_id": "fintech_3_report_001",
      "vertical": "fintech",
      "month": 3,
      "type": "report",
      "url": "/golden-flows/fintech",
      "title": "Fintech Audit Report — Month 3"
    }
  ]
}
