{
  "schema_version": "1.0.0",
  "payload_type": "artifact_links",
  "vertical": "saas",
  "artifacts": [
    {
      "artifact_id": "saas_3_dashboard_001",
      "vertical": "saas",
      "month": 3,
      "type": "dashboard",
      "url": "https://demo.bayesiq.com/dashboards/saas/month-3",
      "title": "SaaS Data Quality Dashboard — Month 3"
    },
    {
      "artifact_id": "saas_3_report_001",
      "vertical": "saas",
      "month": 3,
      "type": "report",
      "url": "https://demo.bayesiq.com/reports/saas/month-3",
      "title": "SaaS Audit Report — Month 3"
    }
  ]
}
