{
  "schema_version": "1.0.0",
  "payload_type": "artifact_links",
  "vertical": "retail",
  "artifacts": [
    {
      "artifact_id": "retail_3_dashboard_001",
      "vertical": "retail",
      "month": 3,
      "type": "dashboard",
      "url": "https://demo.bayesiq.com/dashboards/retail/month-3",
      "title": "Retail Data Quality Dashboard — Month 3"
    },
    {
      "artifact_id": "retail_3_report_001",
      "vertical": "retail",
      "month": 3,
      "type": "report",
      "url": "https://demo.bayesiq.com/reports/retail/month-3",
      "title": "Retail Audit Report — Month 3"
    }
  ]
}
