{
  "schema_version": "1.0.0",
  "payload_type": "artifact_links",
  "vertical": "hospital",
  "artifacts": [
    {
      "artifact_id": "hospital_3_dashboard_001",
      "vertical": "hospital",
      "month": 3,
      "type": "dashboard",
      "url": "https://bayesiq-dashboard-golden-flows-hospital.streamlit.app",
      "title": "Healthcare Data Quality Dashboard — Month 3"
    },
    {
      "artifact_id": "hospital_3_report_001",
      "vertical": "hospital",
      "month": 3,
      "type": "report",
      "url": "/golden-flows/hospital",
      "title": "Healthcare Audit Report — Month 3"
    }
  ]
}
